{
  "schema_version": 1,
  "owner_id": "33333333-3333-4333-8333-333333333333",
  "run_id": "66666666-6666-4666-8666-666666666666",
  "plan_id": "22222222-2222-4222-8222-222222222222",
  "created_at": "2026-09-10T00:00:00Z",
  "finished_at": "2026-09-10T00:00:00Z",
  "status": "succeeded",
  "target_count": 1,
  "counts": {"pending": 0, "running": 0, "succeeded": 1, "failed": 0, "unreachable": 0, "not_run": 0, "unknown": 0},
  "hosts": ["lab-global-primary"],
  "warnings": []
}
